{
  "metadata": {
    "title": "Efficient Estimation of Word Representations in Vector Space",
    "authors": [
      {
        "name": "Tomas Mikolov",
        "affiliation": "Google Inc., Mountain View, CA",
        "email": "tmikolov@google.com"
      },
      {
        "name": "Kai Chen", 
        "affiliation": "Google Inc., Mountain View, CA",
        "email": "kaichen@google.com"
      },
      {
        "name": "Greg Corrado",
        "affiliation": "Google Inc., Mountain View, CA", 
        "email": "gcorrado@google.com"
      },
      {
        "name": "Jeffrey Dean",
        "affiliation": "Google Inc., Mountain View, CA",
        "email": "jeff@google.com"
      }
    ],
    "abstract": "We propose two novel model architectures for computing continuous vector representations of words from very large data sets. The quality of these representations is measured in a word similarity task, and the results are compared to the previously best performing techniques based on different types of neural networks. We observe large improvements in accuracy at much lower computational cost, i.e. it takes less than a day to learn high quality word vectors from a 1.6 billion words data set. Furthermore, we show that these vectors provide state-of-the-art performance on our test set for measuring syntactic and semantic word similarities.",
    "keywords": ["word representations", "neural networks", "vector space", "word2vec", "CBOW", "skip-gram"],
    "publication_info": {
      "venue": "arXiv preprint",
      "date": "2013-01-16",
      "arxiv_id": "1301.3781v3",
      "document_class": "workshop paper"
    }
  },
  
  "sections": [
    {
      "id": "introduction",
      "title": "1. Introduction",
      "level": 1,
      "content": "Many current NLP systems and techniques treat words as atomic units - there is no notion of similarity between words, as these are represented as indices in a vocabulary. This choice has several good reasons - simplicity, robustness and the observation that simple models trained on huge amounts of data outperform complex systems trained on less data. An example is the popular N-gram model used for statistical language modeling - today, it is possible to train N-grams on virtually all available data (trillions of words). However, the simple techniques are at their limits in many tasks. For example, the amount of relevant in-domain data for automatic speech recognition is limited - the performance is usually dominated by the size of high quality transcribed speech data (often just millions of words). In machine translation, the existing corpora for many languages contain only a few billions of words or less. Thus, there are situations where simple scaling up of the basic techniques will not result in any significant progress, and we have to focus on more advanced techniques. With progress of machine learning techniques in recent years, it has become possible to train more complex models on much larger data set, and they typically outperform the simple models. Probably the most successful concept is to use distributed representations of words. For example, neural network based language models significantly outperform N-gram models.",
      "subsections": [
        {
          "id": "goals",
          "title": "1.1 Goals of the Paper",
          "level": 2,
          "content": "The main goal of this paper is to introduce techniques that can be used for learning high-quality word vectors from huge data sets with billions of words, and with millions of words in the vocabulary. As far as we know, none of the previously proposed architectures has been successfully trained on more than a few hundred of millions of words, with a modest dimensionality of the word vectors between 50 - 100. We use recently proposed techniques for measuring the quality of the resulting vector representations, with the expectation that not only will similar words tend to be close to each other, but that words can have multiple degrees of similarity. This has been observed earlier in the context of inflectional languages - for example, nouns can have multiple word endings, and if we search for similar words in a subspace of the original vector space, it is possible to find words that have similar endings. Somewhat surprisingly, it was found that similarity of word representations goes beyond simple syntactic regularities. Using a word offset technique where simple algebraic operations are performed on the word vectors, it was shown for example that vector(\"King\") - vector(\"Man\") + vector(\"Woman\") results in a vector that is closest to the vector representation of the word Queen. In this paper, we try to maximize accuracy of these vector operations by developing new model architectures that preserve the linear regularities among words. We design a new comprehensive test set for measuring both syntactic and semantic regularities, and show that many such regularities can be learned with high accuracy. Moreover, we discuss how training time and accuracy depends on the dimensionality of the word vectors and on the amount of the training data."
        },
        {
          "id": "previous_work",
          "title": "1.2 Previous Work", 
          "level": 2,
          "content": "Representation of words as continuous vectors has a long history. A very popular model architecture for estimating neural network language model (NNLM) was proposed in Bengio et al., where a feedforward neural network with a linear projection layer and a non-linear hidden layer was used to learn jointly the word vector representation and a statistical language model. This work has been followed by many others. Another interesting architecture of NNLM was presented in previous work, where the word vectors are first learned using neural network with a single hidden layer. The word vectors are then used to train the NNLM. Thus, the word vectors are learned even without constructing the full NNLM. In this work, we directly extend this architecture, and focus just on the first step where the word vectors are learned using a simple model. It was later shown that the word vectors can be used to significantly improve and simplify many NLP applications. Estimation of the word vectors itself was performed using different model architectures and trained on various corpora, and some of the resulting word vectors were made available for future research and comparison. However, as far as we know, these architectures were significantly more computationally expensive for training than the one proposed in previous work, with the exception of certain version of log-bilinear model where diagonal weight matrices are used."
        }
      ]
    },
    {
      "id": "model_architectures",
      "title": "2. Model Architectures",
      "level": 1,
      "content": "Many different types of models were proposed for estimating continuous representations of words, including the well-known Latent Semantic Analysis (LSA) and Latent Dirichlet Allocation (LDA). In this paper, we focus on distributed representations of words learned by neural networks, as it was previously shown that they perform significantly better than LSA for preserving linear regularities among words; LDA moreover becomes computationally very expensive on large data sets. Similar to previous work, to compare different model architectures we define first the computational complexity of a model as the number of parameters that need to be accessed to fully train the model. Next, we will try to maximize the accuracy, while minimizing the computational complexity. For all the following models, the training complexity is proportional to O = E × T × Q, where E is number of the training epochs, T is the number of the words in the training set and Q is defined further for each model architecture. Common choice is E = 3 - 50 and T up to one billion. All models are trained using stochastic gradient descent and backpropagation.",
      "subsections": [
        {
          "id": "nnlm",
          "title": "2.1 Feedforward Neural Net Language Model (NNLM)",
          "level": 2,
          "content": "The probabilistic feedforward neural network language model has been proposed in Bengio et al. It consists of input, projection, hidden and output layers. At the input layer, N previous words are encoded using 1-of-V coding, where V is size of the vocabulary. The input layer is then projected to a projection layer P that has dimensionality N × D, using a shared projection matrix. As only N inputs are active at any given time, composition of the projection layer is a relatively cheap operation. The NNLM architecture becomes complex for computation between the projection and the hidden layer, as values in the projection layer are dense. For a common choice of N = 10, the size of the projection layer (P) might be 500 to 2000, while the hidden layer size H is typically 500 to 1000 units. Moreover, the hidden layer is used to compute probability distribution over all the words in the vocabulary, resulting in an output layer with dimensionality V. Thus, the computational complexity per each training example is Q = N × D + N × D × H + H × V, where the dominating term is H × V."
        },
        {
          "id": "rnnlm", 
          "title": "2.2 Recurrent Neural Net Language Model (RNNLM)",
          "level": 2,
          "content": "Recurrent neural network based language model has been proposed to overcome certain limitations of the feedforward NNLM, such as the need to specify the context length (the order of the model N), and because theoretically RNNs can efficiently represent more complex patterns than the shallow neural networks. The RNN model does not have a projection layer; only input, hidden and output layer."
        }
      ]
    },
    {
      "id": "new_models",
      "title": "3. New Log-linear Models", 
      "level": 1,